{
  "ticker": "518880",
  "name": "华安黄金易ETF",
  "analysis_time": "2026-03-30T21:15:09.836885",
  "synthesis_time": "2026-03-30T21:15:09.911789",
  "latest_date": "2026-03-30",
  "latest_price": 4.867,
  "latest_change": 0.04,
  "latest_ma20": null,
  "latest_bias_20": null,
  "latest_roc_5": 1.2482,
  "total_score": 9.0,
  "signal_status": "生存预警",
  "dimension_scores": {
    "safety": 0.0,
    "trend": 0.0,
    "momentum": 30.0,
    "weighted_safety": 0.0,
    "weighted_trend": 0.0,
    "weighted_momentum": 9.0
  },
  "strategy_params_version": "1.0.0",
  "source_module": "synthesizer_score_engine"
}